{
  "$schema": "../../../schema/blocks/lab.schema.json",
  "title": "Đã có @Version mà giá sản phẩm vẫn bị ghi đè",
  "context": "Trang quản trị sản phẩm (Spring Boot 3, JPA/Hibernate 6, PostgreSQL 16). Form sửa sản phẩm gửi `PUT /products/{id}` với toàn bộ field và `version` lấy được khi mở form. Entity `Product` có `@Version private long version;`.",
  "buggyCode": "public record UpdateProductRequest(String name, BigDecimal price, String description, long version) {}\n\n@Service\npublic class ProductService {\n\n    @Transactional\n    public ProductDto update(long id, UpdateProductRequest request) {\n        Product product = productRepository.findById(id).orElseThrow();\n        product.setName(request.name());\n        product.setPrice(request.price());\n        product.setDescription(request.description());\n        return ProductDto.from(product);   // dirty checking sinh UPDATE lúc commit\n    }\n}",
  "symptom": {
    "description": "Lúc 9:00 hai quản trị viên cùng mở form sản phẩm 42 (version 3, giá 199.000). An đổi giá thành 189.000 và lưu lúc 9:05. Bình chỉ sửa mô tả và lưu lúc 9:10. Cả hai nhận 200 OK, nhưng giá quay về 199.000. Log SQL:",
    "output": "09:05:12 PUT /products/42 {\"price\":189000,\"version\":3}  -> 200\n  update product set description=?,name=?,price=?,version=? where id=? and version=?\n  binding: price=189000, version=4, id=42, version=3\n09:10:40 PUT /products/42 {\"price\":199000,\"description\":\"Bản mới\",\"version\":3}  -> 200\n  update product set description=?,name=?,price=?,version=? where id=? and version=?\n  binding: price=199000, version=5, id=42, version=4"
  },
  "diagnosis": {
    "question": "Vì sao `@Version` không chặn được lần lưu của Bình?",
    "options": [
      "Field version kiểu `long` nguyên thuỷ nên Hibernate không theo dõi; phải đổi sang `Long`",
      "Service load entity mới (version 4) rồi bỏ qua version 3 mà Bình gửi lên, nên Hibernate so với version 4 và luôn khớp. `@Version` chỉ bảo vệ khoảng thời gian bên trong một transaction, không bảo vệ khoảng thời gian người dùng mở form",
      "READ COMMITTED cho phép lost update; phải chạy method này ở SERIALIZABLE",
      "Hibernate ghi mọi cột trong `UPDATE`; thêm `@DynamicUpdate` để chỉ ghi cột mô tả là đủ"
    ],
    "answer": 1,
    "explanation": "Câu `UPDATE` thứ hai có `where ... version=4`: đó là version của entity vừa load trong request của Bình, không phải version 3 Bình đã thấy. Hai request cách nhau 5 phút, không chồng lên nhau, nên isolation level không liên quan, và SERIALIZABLE cũng không giúp được. `long` nguyên thuỷ vẫn là version hợp lệ. `@DynamicUpdate` cũng không cứu được: form gửi lại giá cũ 199.000, khác giá đang lưu, nên giá vẫn là cột bị thay đổi và vẫn bị ghi."
  },
  "fix": {
    "code": "@Transactional\npublic ProductDto update(long id, UpdateProductRequest request) {\n    Product product = productRepository.findById(id).orElseThrow();\n    if (product.getVersion() != request.version()) {\n        // người khác đã lưu sau khi client mở form\n        throw new ObjectOptimisticLockingFailureException(Product.class, id);\n    }\n    product.setName(request.name());\n    product.setPrice(request.price());\n    product.setDescription(request.description());\n    return ProductDto.from(product);   // @Version vẫn chặn hai request chạy trùng nhau\n}\n\n// Controller: version đi qua header chuẩn ETag / If-Match thay vì body\n@GetMapping(\"/products/{id}\")\nResponseEntity<ProductDto> get(@PathVariable long id) {\n    ProductDto dto = productService.get(id);\n    return ResponseEntity.ok().eTag(Long.toString(dto.version())).body(dto);   // ETag: \"3\"\n}\n\n@PutMapping(\"/products/{id}\")\nResponseEntity<ProductDto> put(@PathVariable long id,\n                               @RequestHeader(HttpHeaders.IF_MATCH) String ifMatch,\n                               @RequestBody ProductForm form) {\n    long seenVersion = Long.parseLong(ifMatch.replace(\"\\\"\", \"\"));\n    ProductDto dto = productService.update(id, form.withVersion(seenVersion));\n    return ResponseEntity.ok().eTag(Long.toString(dto.version())).body(dto);\n}\n\n@RestControllerAdvice\nclass ConflictHandler {\n    @ExceptionHandler(OptimisticLockingFailureException.class)\n    ProblemDetail onConflict() {   // dùng If-Match thì trả 412 PRECONDITION_FAILED\n        return ProblemDetail.forStatusAndDetail(HttpStatus.CONFLICT,\n            \"Sản phẩm đã được người khác cập nhật. Tải lại để xem thay đổi mới nhất.\");\n    }\n}",
    "explanation": "So sánh tường minh version client đã thấy với version đang lưu, và không gán version của client vào entity đang được quản lý (JPA không cho ứng dụng sửa field version). Kiểm tra trong code bắt xung đột giữa hai lần mở form; `@Version` vẫn cần để bắt hai request chạy trùng thời điểm, vì giữa lúc load và lúc commit vẫn có thể có người ghi. Xung đột kiểu này không nên retry tự động: trả `409 Conflict` khi version nằm trong body, hoặc `412 Precondition Failed` khi version đi qua `If-Match` (thiếu header thì trả `428 Precondition Required`), để Bình tải lại, thấy giá mới rồi sửa mô tả lại. Test bằng hai request mang cùng version cũ: request thứ hai phải nhận 409."
  }
}
